24721,US,Dragon Rises College of Oriental Medicine,,,2023,Dragon Rises College,Gainesville,Florida,32601,3523712833.0,www.dragonrises.edu/,https://dragonrises.edu/prospective-students/,dragonrises.edu/prospective-students/apply-online/,dragonrises.edu/wp-content/uploads/2023/05/Shopping-Sheet-2023-2024-1.pdf,-82.312769,29.667368,Not applicable,"Southeast (AL, AR, FL, GA, KY, LA, MS, NC, SC, TN, VA, WV)",Private not-for-profit,Master's degree,Degree-granting,No,No,,City: Midsize,Implied no,Yes,Implied no,Implied no,Implied no,"Under 1,000",62.0,0.0,,0.0,,,,,,,,,,,,,,,,,,,,,,,,,,,,,,,,,,,,,,,,,,,,,,,,,,,,,,,,,,,,,,,,,,,,,,,,,,,,,,,,,,,,,,,,,,,,,,,,,,,,,,,,,,,,,,,,,,,,,,,,,,,,,,,,,,,,,,,,,,,,,,,,,,,,,,,,,,,,,,,,,,,,,,,,,,,,,,,,,
15694,US,Palm Beach Academy of Health & Beauty,,,2023,,West Palm Beach,Florida,33415-2904,56184500000000.0,www.pbacademy.net/,www.pbacademy.net/admissions.aspx,www.pbacademy.net/admissions.aspx,www.pbacademy.net/calculator.aspx,-80.115507,26.63948,Yes,"Southeast (AL, AR, FL, GA, KY, LA, MS, NC, SC, TN, VA, WV)",Private for-profit,Non-degree granting,"Nondegree-granting, primarily postsecondary",No,Not applicable,,Suburb: Large,Not applicable,Not applicable,Not applicable,Not applicable,Not applicable,"Under 1,000",116.0,0.0,0.0,,,,82.0,0.0,0.0,,60.0,,,,,,,,,,,,,,,,,,,,,,,,,,,,,,,,,,,,,,,,,,,,,,,,,,,,,,,,,,,,,,,,,,,,,,,,,,,,,,,,,,,,,,,,,,,,,,,,,,,,,,,,,,,,,,,,,,,,,,,,,,,,,,,,,,,,,,,,,,,,,,,,,,,,,,,,,,,,,,,,,,,,,,,,,,
43649,US,SABER College,,,2023,,Miami,Florida,33134,3054440000000.0,sabercollege.edu/,sabercollege.edu/,sabercollege.edu/,https://sabercollege.edu/Net-Price-Calculator.html,-80.261299,25.771518,No,"Southeast (AL, AR, FL, GA, KY, LA, MS, NC, SC, TN, VA, WV)",Private not-for-profit,Associate's degree,Degree-granting,No,Not applicable,,City: Large,Not applicable,Not applicable,Not applicable,Not applicable,Not applicable,"Under 1,000",202.0,0.0,0.0,,,,100.0,0.0,0.0,,100.0,,,,,Required to be considered for admission,"Not considered for admission, even if submitted",Required to be considered for admission,"Not considered for admission, even if submitted",Required to be considered for admission,"Not considered for admission, even if submitted","Not considered for admission, even if submitted","Not considered for admission, even if submitted","Not required for admission, but considered if submitted","Not considered for admission, even if submitted (Test Blind)","Not considered for admission, even if submitted (Test Blind)",Required to be considered for admission,136.0,126.0,71.0,,,,,,,,,,,,,,,,,,,,,,,,,,,,,,,,,,,,,,,,,,,,,,,,,,,,,,,,,,,,,,,,,,,,,,,,,,,,,,,,,,,,,,,,,,,,,,,,,,,,,,,,,,,,,,,,,,,,,,,,,,,,,,,,,,,,,,,,,,,,,,,,,,,,,,,
30709,US,Taylor College,,,2023,,Ocala,Florida,34470,3522454119.0,taylorcollege.edu/,taylorcollege.edu/admissions/,https://taylorcollege.edu/apply-online/,https://taylorcollege.edu/net-price-calculator/,-82.102824,29.189031,Yes,"Southeast (AL, AR, FL, GA, KY, LA, MS, NC, SC, TN, VA, WV)",Private for-profit,Associate's degree,Degree-granting,No,Not applicable,,City: Small,Not applicable,Not applicable,Not applicable,Not applicable,Not applicable,"Under 1,000",216.0,0.0,0.0,,,,100.0,0.0,0.0,,62.0,,13263.0,,36432.0,,,,,,,,,,,,,,,,,,,,,,,,,,,,,,,,,,,,,,,,,,,,,,,,,,,,,,,,,,,,,,,,,,,,,,,,,,,,,,,,,,,,,,,,,,,,,,,,,,,,,,,,,,,,,,,,,,,,,,,,,,,,,,,,,,,,,,,,,,,,,,,,,,,,,,,,,,,,,,,,,,,,,,
35527,US,Pensacola School of Massage Therapy & Health Careers,,,2023,,Pensacola,Florida,32504,8504741330.0,www.psmthc.com/,www.psmthc.com/,,https://psmthc.com/consumer-info/,-87.195529,30.494755,Yes,"Southeast (AL, AR, FL, GA, KY, LA, MS, NC, SC, TN, VA, WV)",Private for-profit,Non-degree granting,"Nondegree-granting, primarily postsecondary",No,Not applicable,,City: Small,Not applicable,Not applicable,Not applicable,Not applicable,Not applicable,"Under 1,000",56.0,0.0,0.0,,,,88.0,0.0,0.0,,66.0,,,,,,,,,,,,,,,,,,,,,,,,,,,,,,,,,,,,,,,,,,,,,,,,,,,,,,,,,,,,,,,,,,,,,,,,,,,,,,,,,,,,,,,,,,,,,,,,,,,,,,,,,,,,,,,,,,,,,,,,,,,,,,,,,,,,,,,,,,,,,,,,,,,,,,,,,,,,,,,,,,,,,,,,,,
37646,US,Ideal Beauty Academy,,,2023,,Jeffersonville,Indiana,47130,8122821371.0,idealbeautyacademy.net/,,,idealbeautyacademy.net/consumer-information/,-85.730456,38.288401,Yes,"Great Lakes (IL, IN, MI, OH, WI)",Private for-profit,Non-degree granting,"Nondegree-granting, primarily postsecondary",No,Not applicable,,Suburb: Large,Not applicable,Not applicable,Not applicable,Not applicable,Not applicable,"Under 1,000",2.0,0.0,0.0,,,,50.0,0.0,0.0,,0.0,,,,,,,,,,,,,,,,,,,,,,,,,,,,,,,,,,,,,,,,,,,,,,,,,,,,,,,,,,,,,,,,,,,,,,,,,,,,,,,,,,,,,,,,,,,,,,,,,,,,,,,,,,,,,,,,,,,,,,,,,,,,,,,,,,,,,,,,,,,,,,,,,,,,,,,,,,,,,,,,,,,,,,,,,,
9395,US,Denmark College,,,2023,,Merrillville,Indiana,46410,2197369999.0,www.successbarberschool.com/,,,https://www.denmarkcollege.edu/financial-aid/,-87.357915,41.469921,Yes,"Great Lakes (IL, IN, MI, OH, WI)",Private for-profit,Non-degree granting,"Nondegree-granting, primarily postsecondary",No,Not applicable,,Suburb: Large,Not applicable,Not applicable,Not applicable,Not applicable,Not applicable,"Under 1,000",178.0,0.0,0.0,,,,95.0,0.0,0.0,,79.0,,,,,,,,,,,,,,,,,,,,,,,,,,,,,,,,,,,,,,,,,,,,,,,,,,,,,,,,,,,,,,,,,,,,,,,,,,,,,,,,,,,,,,,,,,,,,,,,,,,,,,,,,,,,,,,,,,,,,,,,,,,,,,,,,,,,,,,,,,,,,,,,,,,,,,,,,,,,,,,,,,,,,,,,,,
29512,US,Louisiana Culinary Institute,,,2023,,Baton Rouge,Louisiana,70816,2257698820.0,www.lci.edu/,,www.lci.edu/apply,https://www.lci.edu/net-price-calculator/npcalc.htm,-91.066085,30.409979,No,"Southeast (AL, AR, FL, GA, KY, LA, MS, NC, SC, TN, VA, WV)",Private for-profit,Associate's degree,Degree-granting,No,Not applicable,,Suburb: Large,Not applicable,Not applicable,Not applicable,Not applicable,Not applicable,"Under 1,000",90.0,0.0,0.0,,,,92.0,0.0,0.0,,90.0,,15575.0,,37023.0,"Not considered for admission, even if submitted","Not considered for admission, even if submitted","Not considered for admission, even if submitted","Not considered for admission, even if submitted",Required to be considered for admission,"Not considered for admission, even if submitted","Not considered for admission, even if submitted",Required to be considered for admission,"Not considered for admission, even if submitted","Not considered for admission, even if submitted (Test Blind)","Not considered for admission, even if submitted (Test Blind)",Required to be considered for admission,47.0,23.0,21.0,,,,,,,,,,,,,,,,,,,,,,,,,,,,,,,,,,,,,,,,,,,,,,,,,,,,,,,,,,,,,,,,,,,,,,,,,,,,,,,,,,,,,,,,,,,,,,,,,,,,,,,,,,,,,,,,,,,,,,,,,,,,,,,,,,,,,,,,,,,,,,,,,,,,,,,
5618,US,Bais Medrash Toras Chesed,,,2023,,Lakewood,New Jersey,08701,73236412202.0,www.bmtc.edu/,,,www.bmtc.edu/net-price-calculator.html,-74.21127,40.099704,No,"Mid East (DE, DC, MD, NJ, NY, PA)",Private not-for-profit,Bachelor's degree,Degree-granting,No,No,,City: Small,Yes,Implied no,Implied no,Implied no,Implied no,"Under 1,000",125.0,0.0,0.0,,,,70.0,70.0,89355.0,3885.0,32.0,,8100.0,14000.0,,"Not considered for admission, even if submitted","Not considered for admission, even if submitted","Not required for admission, but considered if submitted","Not considered for admission, even if submitted",Required to be considered for admission,Required to be considered for admission,"Not considered for admission, even if submitted","Not considered for admission, even if submitted","Not considered for admission, even if submitted","Not considered for admission, even if submitted (Test Blind)","Not considered for admission, even if submitted (Test Blind)","Not considered for admission, even if submitted (Test Blind)",73.0,46.0,33.0,,,,,,,,,,,,,,,,,,,,,,,,,,,,,,,,,,,,,,,,,,,,,,,,,,,,,,,,,,,,,,,,,,,,,,,,,,,,,,,,,,,,,,,,,,,,,,,,,,,,,,,,,,,,,,,,,,,,,,,,,,,,,,,,,,,,,,,,,,,,,,,,,,,,,,,
4061,US,Ace Institute of Technology,,,2023,,New York,New York,10018,2126959700.0,www.acecareer.edu/,www.acecareer.edu/,www.acecareer.edu/contact-us,www.acecareer.edu/NetPriceCalculator/npcalc.htm,-73.993385,40.753658,Yes,"Mid East (DE, DC, MD, NJ, NY, PA)",Private for-profit,Non-degree granting,"Nondegree-granting, primarily postsecondary",No,Not applicable,,City: Large,Not applicable,Not applicable,Not applicable,Not applicable,Not applicable,"Under 1,000",264.0,6.0,6.0,,,,88.0,0.0,0.0,,71.0,,,,,,,,,,,,,,,,,,,,,,,,,,,,,,,,,,,,,,,,,,,,,,,,,,,,,,,,,,,,,,,,,,,,,,,,,,,,,,,,,,,,,,,,,,,,,,,,,,,,,,,,,,,,,,,,,,,,,,,,,,,,,,,,,,,,,,,,,,,,,,,,,,,,,,,,,,,,,,,,,,,,,,,,,,
34395,US,Dayton School of Medical Massage,,,2023,,Dayton,Ohio,45429,9372946994.0,www.massageschools.com/,www.massageschools.com/,,www.massageschools.com/netcalc/npcalc.htm,-84.168901,39.682932,Yes,"Great Lakes (IL, IN, MI, OH, WI)",Private for-profit,Non-degree granting,"Nondegree-granting, primarily postsecondary",No,Not applicable,,City: Small,Not applicable,Not applicable,Not applicable,Not applicable,Not applicable,"Under 1,000",425.0,0.0,0.0,,,,96.0,0.0,0.0,,73.0,,18122.0,,37600.0,,,,,,,,,,,,,,,,,,,,,,,,,,,,,,,,,,,,,,,,,,,,,,,,,,,,,,,,,,,,,,,,,,,,,,,,,,,,,,,,,,,,,,,,,,,,,,,,,,,,,,,,,,,,,,,,,,,,,,,,,,,,,,,,,,,,,,,,,,,,,,,,,,,,,,,,,,,,,,,,,,,,,,
47997,US,Visible Music College,,,2023,,Memphis,Tennessee,38103,9013813939.0,www.visible.edu/,www.visible.edu/,visible.edu/admissions-2/apply-now/,https://visible.vfao.com/aidestimator/default.aspx,-90.049381,35.144586,No,"Southeast (AL, AR, FL, GA, KY, LA, MS, NC, SC, TN, VA, WV)",Private not-for-profit,Master's degree,Degree-granting,No,No,,City: Large,Yes,Yes,Implied no,Implied no,Implied no,"Under 1,000",182.0,7.0,7.0,7.0,,,88.0,57.0,92806.0,3867.0,48.0,,22000.0,34931.0,34931.0,Required to be considered for admission,"Not considered for admission, even if submitted",Required to be considered for admission,"Not considered for admission, even if submitted",Required to be considered for admission,Required to be considered for admission,"Not required for admission, but considered if submitted","Not required for admission, but considered if submitted","Not considered for admission, even if submitted","Not required for admission, but considered if submitted (Test Optional)","Not required for admission, but considered if submitted (Test Optional)",Required to be considered for admission,136.0,39.0,31.0,6.0,19.0,,,24.0,28.0,20.0,,,,,,,,,,,,,,,,,,,,,,,,,,,,,,,,,,,,,,,,,,,,,,,,,,,,,,,,,,,,,,,,,,,,,,,,,,,,,,,,,,,,,,,,,,,,,,,,,,,,,,,,,,,,,,,,,,,,,,,,,,,,,,,,,,,,,,,,,,,,,,,,
28888,US,CCI Training Center-Arlington,,,2023,,Arlington,Texas,76011,8172260000000.0,www.ccitraining.edu/,www.ccitraining.edu/,www.ccitraining.edu/,www.ccitraining.edu/netprice/npcalc.htm,-97.101289,32.755006,Yes,"Southwest (AZ, NM, OK, TX)",Private for-profit,Non-degree granting,"Nondegree-granting, primarily postsecondary",No,Not applicable,,City: Large,Not applicable,Not applicable,Not applicable,Not applicable,Not applicable,"Under 1,000",187.0,0.0,0.0,,,,94.0,7.0,30080.0,1880.0,70.0,,,,,,,,,,,,,,,,,,,,,,,,,,,,,,,,,,,,,,,,,,,,,,,,,,,,,,,,,,,,,,,,,,,,,,,,,,,,,,,,,,,,,,,,,,,,,,,,,,,,,,,,,,,,,,,,,,,,,,,,,,,,,,,,,,,,,,,,,,,,,,,,,,,,,,,,,,,,,,,,,,,,,,,,,,
5704,US,Champion Beauty College,,,2023,,Houston,Texas,77068,28158391176.0,championbeautycollege.com/,,,championbeautycollege.com/,-95.489161,29.99352,Yes,"Southwest (AZ, NM, OK, TX)",Private for-profit,Non-degree granting,"Nondegree-granting, primarily postsecondary",No,Not applicable,,Suburb: Large,Not applicable,Not applicable,Not applicable,Not applicable,Not applicable,"Under 1,000",26.0,0.0,0.0,,,,98.0,0.0,0.0,,77.0,,,,,,,,,,,,,,,,,,,,,,,,,,,,,,,,,,,,,,,,,,,,,,,,,,,,,,,,,,,,,,,,,,,,,,,,,,,,,,,,,,,,,,,,,,,,,,,,,,,,,,,,,,,,,,,,,,,,,,,,,,,,,,,,,,,,,,,,,,,,,,,,,,,,,,,,,,,,,,,,,,,,,,,,,,
17356,US,Southeast Texas Career Institute,,,2023,,Silsbee,Texas,77656,4093860000000.0,www.setxci.com/,www.setxci.com/,,https://setxci.com/netprice-calculator/,-94.169885,30.341896,Yes,"Southwest (AZ, NM, OK, TX)",Private for-profit,Non-degree granting,"Nondegree-granting, primarily postsecondary",No,Not applicable,,Town: Fringe,Not applicable,Not applicable,Not applicable,Not applicable,Not applicable,"Under 1,000",74.0,0.0,0.0,,,,100.0,0.0,0.0,,63.0,,,,,,,,,,,,,,,,,,,,,,,,,,,,,,,,,,,,,,,,,,,,,,,,,,,,,,,,,,,,,,,,,,,,,,,,,,,,,,,,,,,,,,,,,,,,,,,,,,,,,,,,,,,,,,,,,,,,,,,,,,,,,,,,,,,,,,,,,,,,,,,,,,,,,,,,,,,,,,,,,,,,,,,,,,
44830,US,Southwest Technical College,,,2023,Southwest Tech,Cedar City,Utah,84720,4355862899.0,https://stech.edu/,https://stech.edu/admissions/enrollment/,https://portal.stech.edu/Portal/Student/Application,https://stech.edu/wp-content/uploads/2017/07/npcalc.htm,-113.069916,37.664147,Yes,"Rocky Mountains (CO, ID, MT, UT, WY)",Public,Non-degree granting,"Nondegree-granting, primarily postsecondary",No,Not applicable,,Town: Remote,Not applicable,Not applicable,Not applicable,Not applicable,Not applicable,"Under 1,000",649.0,0.0,0.0,,,,70.0,3.0,656.0,328.0,93.0,,,,,,,,,,,,,,,,,,,,,,,,,,,,,,,,,,,,,,,,,,,,,,,,,,,,,,,,,,,,,,,,,,,,,,,,,,,,,,,,,,,,,,,,,,,,,,,,,,,,,,,,,,,,,,,,,,,,,,,,,,,,,,,,,,,,,,,,,,,,,,,,,,,,,,,,,,,,,,,,,,,,,,,,,,
35771,US,Virginia Beach Theological Seminary,,,2023,,Virginia Beach,Virginia,23464-6847,7574793706.0,www.vbts.edu/,,,www.vbts.edu/net-price-calculator/,-76.189475,36.765993,No,"Southeast (AL, AR, FL, GA, KY, LA, MS, NC, SC, TN, VA, WV)",Private not-for-profit,Doctor's degree -  professional practice,Degree-granting,No,No,,City: Large,Implied no,Yes,Implied no,Yes,Implied no,"Under 1,000",35.0,0.0,0.0,0.0,,,,,,,,,,,,Required to be considered for admission,"Not required for admission, but considered if submitted",Required to be considered for admission,"Not considered for admission, even if submitted",Required to be considered for admission,"Not considered for admission, even if submitted",Required to be considered for admission,Required to be considered for admission,"Not considered for admission, even if submitted","Not considered for admission, even if submitted (Test Blind)","Not required for admission, but considered if submitted (Test Optional)","Not considered for admission, even if submitted (Test Blind)",0.0,,,,,,,,,,,,,,,,,,,,,,,,,,,,,,,,,,,,,,,,,,,,,,,,,,,,,,,,,,,,,,,,,,,,,,,,,,,,,,,,,,,,,,,,,,,,,,,,,,,,,,,,,,,,,,,,,,,,,,,,,,,,,,,,,,,,,,,,,,,,,,,,,,,,,,,,,
38860,US,Milwaukee Career College,,,2023,,Milwaukee,Wisconsin,53222,4142572939.0,www.mkecc.edu/,mkecc.edu/admissions/,,mkecc.edu/MCCNetpriceindex.html,-88.048714,43.074192,No,"Great Lakes (IL, IN, MI, OH, WI)",Private for-profit,Associate's degree,Degree-granting,No,Not applicable,,Suburb: Large,Not applicable,Not applicable,Not applicable,Not applicable,Not applicable,"Under 1,000",73.0,0.0,0.0,,,,98.0,0.0,0.0,,48.0,,,,,"Not considered for admission, even if submitted","Not considered for admission, even if submitted","Not considered for admission, even if submitted","Not considered for admission, even if submitted","Not considered for admission, even if submitted","Not considered for admission, even if submitted","Not considered for admission, even if submitted","Not considered for admission, even if submitted","Not considered for admission, even if submitted","Not considered for admission, even if submitted (Test Blind)","Not considered for admission, even if submitted (Test Blind)",Required to be considered for admission,96.0,69.0,38.0,,,,,,,,,,,,,,,,,,,,,,,,,,,,,,,,,,,,,,,,,,,,,,,,,,,,,,,,,,,,,,,,,,,,,,,,,,,,,,,,,,,,,,,,,,,,,,,,,,,,,,,,,,,,,,,,,,,,,,,,,,,,,,,,,,,,,,,,,,,,,,,,,,,,,,,
29137,US,University of the West,,,2023,UWest,Rosemead,California,91770,6265718811.0,www.uwest.edu/,www.uwest.edu/admissions-information/,applyuwest.org/,www.uwest.edu/net-price-calculator/,-118.082964,34.045985,No,"Far West (AK, CA, HI, NV, OR, WA)",Private not-for-profit,Doctor's degree - research/scholarship and professional practice,Degree-granting,No,No,,Suburb: Large,Yes,Yes,Yes,Yes,Implied no,"Under 1,000",154.0,47.0,62.0,39.0,,,100.0,80.0,18699.0,4675.0,31.0,50.0,14718.0,32796.0,41680.0,Required to be considered for admission,"Not required for admission, but considered if submitted","Not required for admission, but considered if submitted","Not required for admission, but considered if submitted","Not required for admission, but considered if submitted","Not required for admission, but considered if submitted","Not required for admission, but considered if submitted",Required to be considered for admission,"Not considered for admission, even if submitted","Not considered for admission, even if submitted (Test Blind)",Required to be considered for admission,"Not considered for admission, even if submitted (Test Blind)",7.0,7.0,4.0,,,,,,,,,,,,,,,,,,,,,,,,,,,,,,,,,,,,,,,,,,,,,,,,,,,,,,,,,,,,,,,,,,,,,,,,,,,,,,,,,,,,,,,,,,,,,,,,,,,,,,,,,,,,,,,,,,,,,,,,,,,,,,,,,,,,,,,,,,,,,,,,,,,,,,,
30795,US,South University-Tampa,,,2023,,Tampa,Florida,33614-7095,8133933800.0,"www.southuniversity.edu/tampa#location=Tampa, FL",www.southuniversity.edu/admissions,www.southuniversity.edu/admissions/admission-info/applying,www.southuniversity.edu/tampa/net-price-calculator,-82.500357,27.982269,Yes,"Southeast (AL, AR, FL, GA, KY, LA, MS, NC, SC, TN, VA, WV)",Private for-profit,Doctor's degree -  professional practice,Degree-granting,No,No,,City: Large,Yes,Yes,Implied no,Yes,Implied no,"Under 1,000",720.0,1.0,1.0,1.0,,,86.0,14.0,5300.0,2650.0,5.0,,18238.0,,36577.0,,,,,,,,,,,,,,,,,,,,,,,,,,,,,,,,,,,,,,,,,,,,,,,,,,,,,,,,,,,,,,,,,,,,,,,,,,,,,,,,,,,,,,,,,,,,,,,,,,,,,,,,,,,,,,,,,,,,,,,,,,,,,,,,,,,,,,,,,,,,,,,,,,,,,,,,,,,,,,,,,,,,,,
19992,US,Milan Institute of Cosmetology-San Antonio Military,,,2023,,San Antonio,Texas,78221,2109225900.0,www.milaninstitute.edu/,www.milaninstitute.edu/,www.milaninstitute.edu/,solutions.campusivy.com/Apps/NPC/NPCWizard/Wizard?institutionId=12600,-98.500738,29.358241,Yes,"Southwest (AZ, NM, OK, TX)",Private for-profit,Non-degree granting,"Nondegree-granting, primarily postsecondary",No,Not applicable,,City: Large,Not applicable,Not applicable,Not applicable,Not applicable,Not applicable,"Under 1,000",202.0,0.0,0.0,,,,71.0,0.0,0.0,,51.0,,,,,,,,,,,,,,,,,,,,,,,,,,,,,,,,,,,,,,,,,,,,,,,,,,,,,,,,,,,,,,,,,,,,,,,,,,,,,,,,,,,,,,,,,,,,,,,,,,,,,,,,,,,,,,,,,,,,,,,,,,,,,,,,,,,,,,,,,,,,,,,,,,,,,,,,,,,,,,,,,,,,,,,,,,
21424,US,Appalachian College of Pharmacy,,,2023,,Oakwood,Virginia,24631,27649800000000.0,www.acp.edu/,www.acp.edu/admissions-aid/prerequisites/,www.acp.edu/admissions-aid/domestic-application-process/,https://www.acp.edu/admissions-aid/financial-aid-office/,-82.006195,37.211629,Not applicable,"Southeast (AL, AR, FL, GA, KY, LA, MS, NC, SC, TN, VA, WV)",Private not-for-profit,Doctor's degree -  professional practice,Degree-granting,No,No,,Rural: Distant,Implied no,Implied no,Implied no,Yes,Implied no,"Under 1,000",125.0,4.0,,4.0,,,,,,,,,,,,,,,,,,,,,,,,,,,,,,,,,,,,,,,,,,,,,,,,,,,,,,,,,,,,,,,,,,,,,,,,,,,,,,,,,,,,,,,,,,,,,,,,,,,,,,,,,,,,,,,,,,,,,,,,,,,,,,,,,,,,,,,,,,,,,,,,,,,,,,,,,,,,,,,,,,,,,,,,,,,,,,,,,
1333,US,Paul Mitchell the School-Tampa,,,2023,,Tampa,Florida,33625,8139729838.0,paulmitchell.edu/tampa,paulmitchell.edu/tampa/request-enrollment-information,paulmitchell.edu/tampa/get-started,paulmitchell.edu/tampa/tuition-calculator,-82.574571,28.06864,Yes,"Southeast (AL, AR, FL, GA, KY, LA, MS, NC, SC, TN, VA, WV)",Private for-profit,Non-degree granting,"Nondegree-granting, primarily postsecondary",No,Not applicable,,Suburb: Large,Not applicable,Not applicable,Not applicable,Not applicable,Not applicable,"Under 1,000",136.0,0.0,0.0,,13.0,87.0,69.0,0.0,0.0,,65.0,,,,,,,,,,,,,,,,,,,,,,,,,,,,,,,,,,,,,,,,,,,,,,,,,,,,,,,,,,,,,,,,,,,,,,,,,,,,,,,,,,,,,,,,,,,,,,,,,,,,,,,,,,,,,,,,,,,,,,,,,,,,,,,,,,,,,,,,,,,,,,,,,,,,,,,,,,,,,,,,,,,,,,,,,,
8565,US,Paul Mitchell the School-San Diego,,,2023,,San Diego,California,92101,6193981590.0,paulmitchell.edu/sandiego,paulmitchell.edu/sandiego/request-enrollment-information,paulmitchell.edu/sandiego/get-started,paulmitchell.edu/sandiego/tuition-calculator,-117.160838,32.719128,Yes,"Far West (AK, CA, HI, NV, OR, WA)",Private for-profit,Non-degree granting,"Nondegree-granting, primarily postsecondary",No,Not applicable,,City: Large,Not applicable,Not applicable,Not applicable,Not applicable,Not applicable,"Under 1,000",250.0,0.0,0.0,,0.0,0.0,86.0,5.0,500.0,500.0,63.0,,,,,,,,,,,,,,,,,,,,,,,,,,,,,,,,,,,,,,,,,,,,,,,,,,,,,,,,,,,,,,,,,,,,,,,,,,,,,,,,,,,,,,,,,,,,,,,,,,,,,,,,,,,,,,,,,,,,,,,,,,,,,,,,,,,,,,,,,,,,,,,,,,,,,,,,,,,,,,,,,,,,,,,,,,
44742,US,Paul Mitchell the School-Michigan,,,2023,,Sterling Heights,Michigan,48313,5869398600.0,paulmitchell.edu/sterlingheights,paulmitchell.edu/sterlingheights/request-enrollment-information,paulmitchell.edu/sterlingheights/get-started,paulmitchell.edu/sterlingheights/tuition-calculator,-83.028804,42.593439,Yes,"Great Lakes (IL, IN, MI, OH, WI)",Private for-profit,Non-degree granting,"Nondegree-granting, primarily postsecondary",No,Not applicable,,Suburb: Large,Not applicable,Not applicable,Not applicable,Not applicable,Not applicable,"Under 1,000",162.0,0.0,0.0,,0.0,0.0,93.0,0.0,0.0,,100.0,,,,,,,,,,,,,,,,,,,,,,,,,,,,,,,,,,,,,,,,,,,,,,,,,,,,,,,,,,,,,,,,,,,,,,,,,,,,,,,,,,,,,,,,,,,,,,,,,,,,,,,,,,,,,,,,,,,,,,,,,,,,,,,,,,,,,,,,,,,,,,,,,,,,,,,,,,,,,,,,,,,,,,,,,,
36465,US,Paul Mitchell the School-Sherman Oaks,,,2023,,Sherman Oaks,California,91403,8007618006.0,paulmitchell.edu/shermanoaks,paulmitchell.edu/shermanoaks/request-enrollment-information,paulmitchell.edu/shermanoaks/get-started,paulmitchell.edu/shermanoaks/tuition-calculator,-118.467289,34.154315,Yes,"Far West (AK, CA, HI, NV, OR, WA)",Private for-profit,Non-degree granting,"Nondegree-granting, primarily postsecondary",No,Not applicable,,City: Large,Not applicable,Not applicable,Not applicable,Not applicable,Not applicable,"Under 1,000",280.0,0.0,0.0,,0.0,0.0,82.0,1.0,2000.0,2000.0,78.0,,,,,,,,,,,,,,,,,,,,,,,,,,,,,,,,,,,,,,,,,,,,,,,,,,,,,,,,,,,,,,,,,,,,,,,,,,,,,,,,,,,,,,,,,,,,,,,,,,,,,,,,,,,,,,,,,,,,,,,,,,,,,,,,,,,,,,,,,,,,,,,,,,,,,,,,,,,,,,,,,,,,,,,,,,
14235,US,Paul Mitchell the School-Tysons Corner,,,2023,,McLean,Virginia,22102,7032880008.0,paulmitchell.edu/tysonscorner,paulmitchell.edu/tysonscorner/request-enrollment-information,paulmitchell.edu/tysonscorner/get-started,paulmitchell.edu/tysonscorner/tuition-calculator,-77.222536,38.916957,Yes,"Southeast (AL, AR, FL, GA, KY, LA, MS, NC, SC, TN, VA, WV)",Private for-profit,Non-degree granting,"Nondegree-granting, primarily postsecondary",No,Not applicable,,Suburb: Large,Not applicable,Not applicable,Not applicable,Not applicable,Not applicable,"Under 1,000",94.0,1.0,1.0,,0.0,0.0,73.0,0.0,0.0,,83.0,,,,,,,,,,,,,,,,,,,,,,,,,,,,,,,,,,,,,,,,,,,,,,,,,,,,,,,,,,,,,,,,,,,,,,,,,,,,,,,,,,,,,,,,,,,,,,,,,,,,,,,,,,,,,,,,,,,,,,,,,,,,,,,,,,,,,,,,,,,,,,,,,,,,,,,,,,,,,,,,,,,,,,,,,,
35598,US,Fortis College-Columbus,,,2023,,Westerville,Ohio,43081,6148822551.0,https://www.fortis.edu/,https://www.fortis.edu/admissions.html,https://www.fortis.edu/apply-online.html,https://www.fortis.edu/content/dam/fortis/compliance/netpricecalc/npcalc-fortis_columbus.htm,-82.900188,40.083063,Yes,"Great Lakes (IL, IN, MI, OH, WI)",Private for-profit,Associate's degree,Degree-granting,No,Not applicable,,Suburb: Large,Not applicable,Not applicable,Not applicable,Not applicable,Not applicable,"Under 1,000",761.0,0.0,0.0,,,,97.0,45.0,4781.0,184.0,32.0,,14148.0,,37772.0,,,,,,,,,,,,,,,,,,,,,,,,,,,,,,,,,,,,,,,,,,,,,,,,,,,,,,,,,,,,,,,,,,,,,,,,,,,,,,,,,,,,,,,,,,,,,,,,,,,,,,,,,,,,,,,,,,,,,,,,,,,,,,,,,,,,,,,,,,,,,,,,,,,,,,,,,,,,,,,,,,,,,,
41346,US,Fortis College-Cincinnati,,,2023,Bohecker College,Cincinnati,Ohio,45246,51377100000000.0,https://www.fortis.edu/,https://www.fortis.edu/admissions.html,https://www.fortis.edu/apply-online.html,https://www.fortis.edu/content/dam/fortis/compliance/netpricecalc/npcalc-fortis_cincinnati.htm,-84.444969,39.283312,Yes,"Great Lakes (IL, IN, MI, OH, WI)",Private for-profit,Associate's degree,Degree-granting,No,Not applicable,,Suburb: Large,Not applicable,Not applicable,Not applicable,Not applicable,Not applicable,"Under 1,000",403.0,0.0,0.0,,,,89.0,72.0,14651.0,319.0,41.0,,14283.0,,39348.0,,,,,,,,,,,,,,,,,,,,,,,,,,,,,,,,,,,,,,,,,,,,,,,,,,,,,,,,,,,,,,,,,,,,,,,,,,,,,,,,,,,,,,,,,,,,,,,,,,,,,,,,,,,,,,,,,,,,,,,,,,,,,,,,,,,,,,,,,,,,,,,,,,,,,,,,,,,,,,,,,,,,,,
13139,US,Blue Cliff College-Alexandria,,,2023,,Alexandria,Louisiana,71301,3184452778.0,bluecliffcollege.edu/,www.bluecliffcollege.edu/admissions/,www.bluecliffcollege.edu/,www.bluecliffcollege.edu/net-price-calculator/,-92.475371,31.276699,Yes,"Southeast (AL, AR, FL, GA, KY, LA, MS, NC, SC, TN, VA, WV)",Private for-profit,Associate's degree,Degree-granting,No,Not applicable,,City: Small,Not applicable,Not applicable,Not applicable,Not applicable,Not applicable,"Under 1,000",479.0,0.0,0.0,,,,93.0,1.0,8833.0,1767.0,33.0,,,,,,,,,,,,,,,,,,,,,,,,,,,,,,,,,,,,,,,,,,,,,,,,,,,,,,,,,,,,,,,,,,,,,,,,,,,,,,,,,,,,,,,,,,,,,,,,,,,,,,,,,,,,,,,,,,,,,,,,,,,,,,,,,,,,,,,,,,,,,,,,,,,,,,,,,,,,,,,,,,,,,,,,,,
2155,US,Brite Divinity School,,,2023,,Fort Worth,Texas,76129,8172577575.0,www.brite.edu/,www.brite.edu/admission/,,www.brite.edu/admissions/financial-aid/,-97.359137,32.710145,Not applicable,"Southwest (AZ, NM, OK, TX)",Private not-for-profit,Doctor's degree - research/scholarship,Degree-granting,No,No,,City: Large,Implied no,Yes,Yes,Implied no,Yes,"Under 1,000",119.0,1.0,,1.0,,,,,,,,,,,,,,,,,,,,,,,,,,,,,,,,,,,,,,,,,,,,,,,,,,,,,,,,,,,,,,,,,,,,,,,,,,,,,,,,,,,,,,,,,,,,,,,,,,,,,,,,,,,,,,,,,,,,,,,,,,,,,,,,,,,,,,,,,,,,,,,,,,,,,,,,,,,,,,,,,,,,,,,,,,,,,,,,,
