unitid,County,institution name,wiki summary,Web Scrape Summary,Data year,HD2023.Institution name alias,HD2023.City location of institution,HD2023.State abbreviation,HD2023.ZIP code,HD2023.General information telephone number,HD2023.Institution's internet website address,HD2023.Admissions office web address,HD2023.Online application web address,HD2023.Net price calculator web address,HD2023.Longitude location of institution,HD2023.Latitude location of institution,IC2023.Open admission policy,HD2023.Bureau of Economic Analysis (BEA) regions,HD2023.Control of institution,HD2023.Highest degree offered,HD2023.Degree-granting status,HD2023.Institution grants a medical degree,HD2023.Institution has hospital,HD2023.Historically Black College or University,HD2023.Degree of urbanization (Urban-centric locale),IC2023.Bachelor's degree,IC2023.Master's degree,IC2023.Doctor's degree - research/scholarship,IC2023.Doctor's degree - professional practice,IC2023.Doctor's degree - other,HD2023.Institution size category,DRVEF2023.Total  enrollment,DRVEF2023.Percent of total enrollment that are U.S. Nonresident,DRVEF2023.Percent of undergraduate enrollment that are U.S. Nonresident,DRVEF2023.Percent of graduate enrollment that are U.S. Nonresident,DRVEF2023.Number of first-time undergraduates - foreign countries,DRVEF2023.Percent of first-time undergraduates - foreign countries,SFA2223.Percent of full-time first-time undergraduates awarded any financial aid,SFA2223.Percent of full-time first-time undergraduates awarded institutional grant aid,SFA2223.Total amount of institutional grant aid awarded to full-time first-time undergraduates,SFA2223.Average amount of institutional grant aid awarded to full-time first-time undergraduates,"DRVGR2023.Graduation rate, total cohort","DRVGR2023.Graduation rate, U.S. Nonresident","DRVIC2023.Tuition and fees, 2023-24",DRVIC2023.Total price for out-of-state students living on campus 2023-24,DRVIC2023.Total price for out-of-state students living off campus (not with family)  2023-24,ADM2023.Secondary school GPA,ADM2023.Secondary school rank,ADM2023.Secondary school record,ADM2023.Completion of college-preparatory program,ADM2023.Recommendations,ADM2023.Formal demonstration of competencies,ADM2023.Work experience,ADM2023.Personal statement or essay,ADM2023.Legacy status,ADM2023.Admission test scores,ADM2023.English Proficiency Test,"ADM2023.Other Test (Wonderlic, WISC-III, etc.)",ADM2023.Applicants total,ADM2023.Admissions total,ADM2023.Enrolled total,ADM2023.Percent of first-time degree/certificate-seeking students submitting SAT scores,ADM2023.Percent of first-time degree/certificate-seeking students submitting ACT scores,ADM2023.SAT Evidence-Based Reading and Writing 75th percentile score,ADM2023.SAT Math 75th percentile score,ADM2023.ACT Composite 75th percentile score,ADM2023.ACT English 75th percentile score,ADM2023.ACT Math 75th percentile score,avg_rent_1br_center_usd,avg_utilities_monthly_usd,avg_transport_pass_usd,avg_meal_inexpensive_usd,city_cost_of_living_index,application_deadline,specific_requirements_json,established_year,national_accreditation_body,international_accreditation_bodies,campus_setting,has_multiple_campuses,academic_focus,academic_calendar_system,number_of_undergrad_majors,number_of_masters_programs,languages_of_instruction_1,languages_of_instruction_2,languages_of_instruction_3,languages_of_instruction_4,languages_of_instruction_5,application_fee_international,application_fee_currency,application_deadline_ug_international_fall,english_tests_accepted,english_score_ielts_min,visa_sponsorship_available,tuition_undergrad_international_per_year,tuition_currency,scholarships_for_international_students_available,scholarship_types_offered,on_campus_housing_available,housing_guarantee_international,number_of_student_clubs,sports_mascot_name,student_support_services_json,ranking_qs_world,ranking_the_world,ranking_national_or_local,nobel_laureates_count,url_admissions_international,url_campus_virtual_tour,social_media_handles_json,db_record_last_updated,program_ID1,program_ID2,program_ID3,program_ID4,program_ID5,program_ID6,program_ID7,program_ID8,program_ID9,program_ID10,program_ID11,program_ID12,program_ID13,program_ID14,program_ID15,program_ID16,program_ID17,program_ID18,program_ID19,program_ID20,program_ID21,program_ID22,program_ID23,program_ID24,program_ID25,program_ID26,program_ID27,program_ID28,program_ID29,program_ID30,program_ID31,program_ID32,program_ID33,program_ID34,program_ID35,program_ID36,program_ID37,program_ID38,program_ID39,program_ID40,program_ID41,program_ID42,program_ID43,program_ID44,program_ID45,program_ID46,program_ID47,program_ID48,program_ID49,program_ID50,program_ID51,program_ID52,program_ID53,program_ID54,program_ID55,program_ID56,program_ID57,program_ID58,program_ID59,program_ID60,program_ID61,program_ID62,program_ID63,program_ID64,program_ID65,program_ID66,program_ID67,program_ID68,program_ID69,program_ID70,program_ID71,program_ID72,program_ID73,program_ID74,program_ID75,program_ID76,program_ID77,program_ID78,program_ID79,program_ID80,program_ID81,program_ID82,program_ID83,program_ID84,program_ID85,program_ID86,program_ID87,program_ID88,program_ID89,program_ID90,program_ID91,program_ID92,program_ID93,program_ID94,program_ID95,program_ID96,program_ID97,program_ID98,program_ID99,program_ID100
4381,US,Mountwest Community and Technical College,,,2023,MCTC,Huntington,West Virginia,25701,8667103140.0,www.mctc.edu/,www.mctc.edu/admissions/,www.mctc.edu/getting-started/,https://www.mctc.edu/net-price-calculator/,-82.458186,38.392635,Yes,"Southeast (AL, AR, FL, GA, KY, LA, MS, NC, SC, TN, VA, WV)",Public,Associate's degree,Degree-granting,No,Not applicable,,Suburb: Midsize,Not applicable,Not applicable,Not applicable,Not applicable,Not applicable,"1,000 - 4,999",1459.0,1.0,1.0,,0.0,0.0,81.0,15.0,90635.0,2450.0,17.0,,4818.0,,27505.0,,,,,,,,,,,,,,,,,,,,,,,,,,,,,,,,,,,,,,,,,,,,,,,,,,,,,,,,,,,,,,,,,,,,,,,,,,,,,,,,,,,,,,,,,,,,,,,,,,,,,,,,,,,,,,,,,,,,,,,,,,,,,,,,,,,,,,,,,,,,,,,,,,,,,,,,,,,,,,,,,,,,,,
23659,US,American InterContinental University System,,,2023,AIUS,Chandler,Arizona,85286,8777013800.0,https://www.aius.education/,https://www.aius.education/about-aius/institutions,https://www.aius.education/about-aius/institutions,https://www.aius.education/about-aius/institutions,-111.804036,33.278816,Yes,"Southwest (AZ, NM, OK, TX)",Private for-profit,Doctor's degree - research/scholarship and professional practice,Degree-granting,No,No,,City: Large,Yes,Yes,Yes,Yes,Implied no,"10,000 - 19,999",10997.0,0.0,0.0,0.0,1.0,1.0,83.0,14.0,297008.0,2583.0,21.0,,12310.0,,22773.0,,,,,,,,,,,,,,,,,,,,,,,,,,,,,,,,,,,,,,,,,,,,,,,,,,,,,,,,,,,,,,,,,,,,,,,,,,,,,,,,,,,,,,,,,,,,,,,,,,,,,,,,,,,,,,,,,,,,,,,,,,,,,,,,,,,,,,,,,,,,,,,,,,,,,,,,,,,,,,,,,,,,,,
43233,US,American InterContinental University-Houston,,,2023,AIU Houston,Houston,Texas,77042,8322013600.0,www.aiuniv.edu/online-campus/campus-locations/houston,www.aiuniv.edu/admissions-financial-aid/admissions/campus,my.houston.aiuniv.edu/mycampus/general/ec.aspx?src=0,www.aiuniv.edu/tuition-financial-aid/net-price-calculator,-95.548302,29.728216,Yes,"Southwest (AZ, NM, OK, TX)",Private for-profit,Master's degree,Degree-granting,No,No,,City: Large,Yes,Yes,Implied no,Implied no,Implied no,"Under 1,000",163.0,0.0,0.0,0.0,1.0,9.0,67.0,33.0,7811.0,3906.0,45.0,,14842.0,,26087.0,,,,,,,,,,,,,,,,,,,,,,,,,,,,,,,,,,,,,,,,,,,,,,,,,,,,,,,,,,,,,,,,,,,,,,,,,,,,,,,,,,,,,,,,,,,,,,,,,,,,,,,,,,,,,,,,,,,,,,,,,,,,,,,,,,,,,,,,,,,,,,,,,,,,,,,,,,,,,,,,,,,,,,
26080,US,University of California-Merced,,,2023,UC Merced,Merced,California,95343-5603,2092284400.0,ucmerced.edu/,admissions.ucmerced.edu/,admission.universityofcalifornia.edu/apply-now.html,finaidcalc.ucmerced.edu/,-120.424944,37.366237,No,"Far West (AK, CA, HI, NV, OR, WA)",Public,Doctor's degree - research/scholarship,Degree-granting,No,No,,Suburb: Midsize,Yes,Yes,Yes,Implied no,Implied no,"5,000 - 9,999",9147.0,4.0,0.0,39.0,14.0,1.0,85.0,71.0,19115771.0,11298.0,69.0,73.0,14167.0,71462.0,62288.0,Required to be considered for admission,"Not considered for admission, even if submitted",Required to be considered for admission,Required to be considered for admission,"Not considered for admission, even if submitted","Not considered for admission, even if submitted","Not required for admission, but considered if submitted",Required to be considered for admission,"Not considered for admission, even if submitted","Not considered for admission, even if submitted (Test Blind)",Required to be considered for admission,"Not considered for admission, even if submitted (Test Blind)",67891.0,26598.0,2416.0,,,,,,,,,,,,,,,,,,,,,,,,,,,,,,,,,,,,,,,,,,,,,,,,,,,,,,,,,,,,,,,,,,,,,,,,,,,,,,,,,,,,,,,,,,,,,,,,,,,,,,,,,,,,,,,,,,,,,,,,,,,,,,,,,,,,,,,,,,,,,,,,,,,,,,,
11552,US,Remington College-North Houston Campus,,,2023,,Houston,Texas,77067,2818854450.0,https://www.remingtoncollege.edu/locations/houston/greenspoint/,https://www.remingtoncollege.edu/remington-college-admissions/,https://www.remingtoncollege.edu/apply-now-to-remington-college/,https://www.remingtoncollege.edu/net-price/,-95.424881,29.946769,Yes,"Southwest (AZ, NM, OK, TX)",Private not-for-profit,Associate's degree,Degree-granting,No,Not applicable,,City: Large,Not applicable,Not applicable,Not applicable,Not applicable,Not applicable,"Under 1,000",163.0,0.0,0.0,,,,100.0,47.0,24903.0,732.0,51.0,,20001.0,,34108.0,,,,,,,,,,,,,,,,,,,,,,,,,,,,,,,,,,,,,,,,,,,,,,,,,,,,,,,,,,,,,,,,,,,,,,,,,,,,,,,,,,,,,,,,,,,,,,,,,,,,,,,,,,,,,,,,,,,,,,,,,,,,,,,,,,,,,,,,,,,,,,,,,,,,,,,,,,,,,,,,,,,,,,
15163,US,Paul Mitchell the School-Orlando,,,2023,,Oviedo,Florida,32765,8663687447.0,paulmitchell.edu/orlando,paulmitchell.edu/orlando/request-enrollment-information,paulmitchell.edu/orlando/get-started,paulmitchell.edu/orlando/tuition-calculator,-81.234215,28.663679,Yes,"Southeast (AL, AR, FL, GA, KY, LA, MS, NC, SC, TN, VA, WV)",Private for-profit,Non-degree granting,"Nondegree-granting, primarily postsecondary",No,Not applicable,,Suburb: Large,Not applicable,Not applicable,Not applicable,Not applicable,Not applicable,"Under 1,000",133.0,0.0,0.0,,0.0,0.0,89.0,0.0,0.0,,60.0,,,,,,,,,,,,,,,,,,,,,,,,,,,,,,,,,,,,,,,,,,,,,,,,,,,,,,,,,,,,,,,,,,,,,,,,,,,,,,,,,,,,,,,,,,,,,,,,,,,,,,,,,,,,,,,,,,,,,,,,,,,,,,,,,,,,,,,,,,,,,,,,,,,,,,,,,,,,,,,,,,,,,,,,,,
5152,US,Pima Medical Institute-Las Vegas,,,2023,,Las Vegas,Nevada,89121,7024589650.0,https://pmi.edu/,,,https://secure.pmi.edu/npcalc/,-115.102238,36.114105,Yes,"Far West (AK, CA, HI, NV, OR, WA)",Private for-profit,Associate's degree,Degree-granting,No,Not applicable,,City: Midsize,Not applicable,Not applicable,Not applicable,Not applicable,Not applicable,"Under 1,000",748.0,0.0,0.0,,,,90.0,3.0,108000.0,9000.0,49.0,,,,,,,,,,,,,,,,,,,,,,,,,,,,,,,,,,,,,,,,,,,,,,,,,,,,,,,,,,,,,,,,,,,,,,,,,,,,,,,,,,,,,,,,,,,,,,,,,,,,,,,,,,,,,,,,,,,,,,,,,,,,,,,,,,,,,,,,,,,,,,,,,,,,,,,,,,,,,,,,,,,,,,,,,,
49344,US,Remington College-Nashville Campus,,,2023,,Nashville,Tennessee,37214,6158895520.0,https://www.remingtoncollege.edu/locations/nashville/,https://www.remingtoncollege.edu/remington-college-admissions/,https://www.remingtoncollege.edu/apply-now-to-remington-college/,https://www.remingtoncollege.edu/net-price/,-86.665629,36.152337,Yes,"Southeast (AL, AR, FL, GA, KY, LA, MS, NC, SC, TN, VA, WV)",Private not-for-profit,Associate's degree,Degree-granting,No,Not applicable,,City: Large,Not applicable,Not applicable,Not applicable,Not applicable,Not applicable,"Under 1,000",279.0,0.0,0.0,,,,97.0,53.0,33069.0,807.0,58.0,,21230.0,,35947.0,,,,,,,,,,,,,,,,,,,,,,,,,,,,,,,,,,,,,,,,,,,,,,,,,,,,,,,,,,,,,,,,,,,,,,,,,,,,,,,,,,,,,,,,,,,,,,,,,,,,,,,,,,,,,,,,,,,,,,,,,,,,,,,,,,,,,,,,,,,,,,,,,,,,,,,,,,,,,,,,,,,,,,
6498,US,Central Methodist University-College of Graduate and Extended Studies,,,2023,CMU - CGES,Fayette,Missouri,65248-1198,6602483391.0,www.centralmethodist.edu/,www.centralmethodist.edu/admissions/,www.centralmethodist.edu/admissions/applications.html,www.centralmethodist.edu/admissions/financial-aid/calculator/npcalc.htm,-92.685253,39.150497,No,"Plains (IA, KS, MN, MO, NE, ND, SD)",Private not-for-profit,Master's degree,Degree-granting,No,Not applicable,,Rural: Distant,Yes,Yes,Implied no,Implied no,Implied no,"1,000 - 4,999",3601.0,0.0,0.0,0.0,,,80.0,0.0,0.0,,0.0,,6960.0,,22310.0,Required to be considered for admission,"Not required for admission, but considered if submitted",Required to be considered for admission,"Not required for admission, but considered if submitted","Not considered for admission, even if submitted","Not considered for admission, even if submitted","Not considered for admission, even if submitted","Not considered for admission, even if submitted","Not considered for admission, even if submitted","Not required for admission, but considered if submitted (Test Optional)","Not required for admission, but considered if submitted (Test Optional)","Not considered for admission, even if submitted (Test Blind)",280.0,244.0,218.0,0.0,,,,,,,,,,,,,,,,,,,,,,,,,,,,,,,,,,,,,,,,,,,,,,,,,,,,,,,,,,,,,,,,,,,,,,,,,,,,,,,,,,,,,,,,,,,,,,,,,,,,,,,,,,,,,,,,,,,,,,,,,,,,,,,,,,,,,,,,,,,,,,,,,,,,,,
45109,US,North-West College-Riverside,,,2023,,Riverside,California,92503,9513517750.0,www.north-westcollege.edu/,,,nw.edu/ecamp/npc-nwc/npcalc.htm,-117.485881,33.9145,Yes,"Far West (AK, CA, HI, NV, OR, WA)",Private for-profit,Associate's degree,Degree-granting,No,Not applicable,,City: Large,Not applicable,Not applicable,Not applicable,Not applicable,Not applicable,"Under 1,000",680.0,0.0,0.0,,,,94.0,0.0,0.0,,66.0,,,,,,,,,,,,,,,,,,,,,,,,,,,,,,,,,,,,,,,,,,,,,,,,,,,,,,,,,,,,,,,,,,,,,,,,,,,,,,,,,,,,,,,,,,,,,,,,,,,,,,,,,,,,,,,,,,,,,,,,,,,,,,,,,,,,,,,,,,,,,,,,,,,,,,,,,,,,,,,,,,,,,,,,,,
10934,US,Colegio Tecnico de Electricidad Galloza,,,2023,,Aguada,Puerto Rico,00602,7872520922.0,www.ctegpr.com/,https://www.ctegpr.com/,https://www.ctegpr.com/,https://www.collegeraptor.com/Shopping/School/Colegio-Tecnico-de-Electricidad-Galloza-PR--445498,-67.176343,18.354438,Yes,"Other U.S. jurisdictions (AS, FM, GU, MH, MP, PR, PW, VI)",Private for-profit,Non-degree granting,"Nondegree-granting, primarily postsecondary",No,Not applicable,,Suburb: Midsize,Not applicable,Not applicable,Not applicable,Not applicable,Not applicable,"Under 1,000",7.0,0.0,0.0,,0.0,0.0,100.0,0.0,0.0,,83.0,,,,,,,,,,,,,,,,,,,,,,,,,,,,,,,,,,,,,,,,,,,,,,,,,,,,,,,,,,,,,,,,,,,,,,,,,,,,,,,,,,,,,,,,,,,,,,,,,,,,,,,,,,,,,,,,,,,,,,,,,,,,,,,,,,,,,,,,,,,,,,,,,,,,,,,,,,,,,,,,,,,,,,,,,,
38553,US,Spa Tech Institute-Westboro,,,2023,,Westborough,Massachusetts,01581,5088368864.0,www.spatech.edu/,,www.spatech.edu/apply-online.html,www.spatech.edu/consumer-information.html,-71.635686,42.285984,Yes,"New England (CT, ME, MA, NH, RI, VT)",Private for-profit,Non-degree granting,"Nondegree-granting, primarily postsecondary",No,Not applicable,,Suburb: Large,Not applicable,Not applicable,Not applicable,Not applicable,Not applicable,"Under 1,000",194.0,0.0,0.0,,,,81.0,0.0,0.0,,74.0,,,,,,,,,,,,,,,,,,,,,,,,,,,,,,,,,,,,,,,,,,,,,,,,,,,,,,,,,,,,,,,,,,,,,,,,,,,,,,,,,,,,,,,,,,,,,,,,,,,,,,,,,,,,,,,,,,,,,,,,,,,,,,,,,,,,,,,,,,,,,,,,,,,,,,,,,,,,,,,,,,,,,,,,,,
35870,US,Spa Tech Institute-Plymouth,,,2023,,Plymouth,Massachusetts,02360,5087473130.0,www.spatech.edu/,,www.spatech.edu/apply-online.html,www.spatech.edu/consumer-information.html,-70.704453,41.958481,Yes,"New England (CT, ME, MA, NH, RI, VT)",Private for-profit,Non-degree granting,"Nondegree-granting, primarily postsecondary",No,Not applicable,,Suburb: Large,Not applicable,Not applicable,Not applicable,Not applicable,Not applicable,"Under 1,000",236.0,0.0,0.0,,,,75.0,0.0,0.0,,87.0,,,,,,,,,,,,,,,,,,,,,,,,,,,,,,,,,,,,,,,,,,,,,,,,,,,,,,,,,,,,,,,,,,,,,,,,,,,,,,,,,,,,,,,,,,,,,,,,,,,,,,,,,,,,,,,,,,,,,,,,,,,,,,,,,,,,,,,,,,,,,,,,,,,,,,,,,,,,,,,,,,,,,,,,,,
35642,US,Neumont College of Computer Science,,,2023,,Salt Lake City,Utah,84111-1917,8013022800.0,https://www.neumont.edu/,https://www.neumont.edu/future-students,https://admission.neumont.edu/login,https://www.neumont.edu/net-price-calculator,-111.890573,40.766096,No,"Rocky Mountains (CO, ID, MT, UT, WY)",Private for-profit,Bachelor's degree,Degree-granting,No,No,,City: Midsize,Yes,Implied no,Implied no,Implied no,Implied no,"Under 1,000",530.0,0.0,0.0,,,,99.0,95.0,1325761.0,7090.0,57.0,,27375.0,47619.0,42786.0,Required to be considered for admission,"Not considered for admission, even if submitted",Required to be considered for admission,"Not required for admission, but considered if submitted","Not considered for admission, even if submitted","Not required for admission, but considered if submitted","Not required for admission, but considered if submitted","Not considered for admission, even if submitted","Not considered for admission, even if submitted","Not required for admission, but considered if submitted (Test Optional)","Not considered for admission, even if submitted (Test Blind)","Not considered for admission, even if submitted (Test Blind)",1125.0,1004.0,177.0,28.0,51.0,585.0,490.0,28.0,26.0,28.0,,,,,,,,,,,,,,,,,,,,,,,,,,,,,,,,,,,,,,,,,,,,,,,,,,,,,,,,,,,,,,,,,,,,,,,,,,,,,,,,,,,,,,,,,,,,,,,,,,,,,,,,,,,,,,,,,,,,,,,,,,,,,,,,,,,,,,,,,,,,,,,,
30359,US,Johnson & Wales University-Charlotte,,,2023,,Charlotte,North Carolina,28202,8665982427.0,https://www.jwu.edu/campuses/charlotte/,https://www.jwu.edu/admissions/visit-jwu/charlotte/index.html,https://apply.jwu.edu/?_ga=2.226896733.1144428041.1661956580-1253747645.1659483415,https://enroll.jwu.edu/register/NPCCLT?&_ga=2.230592220.1144428041.1661956580-1253747645.1659483415,-80.851208,35.233502,No,"Southeast (AL, AR, FL, GA, KY, LA, MS, NC, SC, TN, VA, WV)",Private not-for-profit,Bachelor's degree,Degree-granting,No,No,,City: Large,Yes,Implied no,Implied no,Implied no,Implied no,"1,000 - 4,999",1128.0,2.0,2.0,,3.0,1.0,100.0,100.0,8276248.0,21331.0,52.0,100.0,40408.0,59010.0,54566.0,Required to be considered for admission,"Not required for admission, but considered if submitted",Required to be considered for admission,"Not required for admission, but considered if submitted","Not required for admission, but considered if submitted","Not required for admission, but considered if submitted","Not required for admission, but considered if submitted","Not required for admission, but considered if submitted","Not required for admission, but considered if submitted","Not required for admission, but considered if submitted (Test Optional)",Required to be considered for admission,"Not considered for admission, even if submitted (Test Blind)",4677.0,3521.0,432.0,9.0,8.0,600.0,540.0,22.0,21.0,22.0,,,,,,,,,,,,,,,,,,,,,,,,,,,,,,,,,,,,,,,,,,,,,,,,,,,,,,,,,,,,,,,,,,,,,,,,,,,,,,,,,,,,,,,,,,,,,,,,,,,,,,,,,,,,,,,,,,,,,,,,,,,,,,,,,,,,,,,,,,,,,,,,
25375,US,Roseman University of Health Sciences,,,2023,Southern Nevada Educational Services Roseman University of Health Sciences    Nevada College of Pharmacy    University of Southern Nevada,Henderson,Nevada,89014,7029904433.0,www.roseman.edu/,,,www.roseman.edu/students-alumni/bursar/tuition-and-fees/,-115.064633,36.073182,Not applicable,"Far West (AK, CA, HI, NV, OR, WA)",Private not-for-profit,Doctor's degree -  professional practice,Degree-granting,Yes,No,,City: Large,Yes,Yes,Implied no,Yes,Implied no,"1,000 - 4,999",1398.0,1.0,0.0,1.0,,,,,,,,,,,,,,,,,,,,,,,,,,,,,,,,,,,,,,,,,,,,,,,,,,,,,,,,,,,,,,,,,,,,,,,,,,,,,,,,,,,,,,,,,,,,,,,,,,,,,,,,,,,,,,,,,,,,,,,,,,,,,,,,,,,,,,,,,,,,,,,,,,,,,,,,,,,,,,,,,,,,,,,,,,,,,,,,,
15134,US,Fortis Institute-Port Saint Lucie,,,2023,,Port Saint Lucie,Florida,34952,7722219799.0,www.fortis.edu/,www.fortis.edu/admissions.html,www.fortis.edu/apply-online.html,www.fortis.edu/content/dam/fortis/compliance/netpricecalc/npcalc-fortis_port_st_lucie.htm,-80.303751,27.3016,Yes,"Southeast (AL, AR, FL, GA, KY, LA, MS, NC, SC, TN, VA, WV)",Private for-profit,Associate's degree,Degree-granting,No,Not applicable,,City: Midsize,Not applicable,Not applicable,Not applicable,Not applicable,Not applicable,"Under 1,000",472.0,0.0,0.0,,,,94.0,48.0,6048.0,252.0,59.0,,14087.0,,41224.0,,,,,,,,,,,,,,,,,,,,,,,,,,,,,,,,,,,,,,,,,,,,,,,,,,,,,,,,,,,,,,,,,,,,,,,,,,,,,,,,,,,,,,,,,,,,,,,,,,,,,,,,,,,,,,,,,,,,,,,,,,,,,,,,,,,,,,,,,,,,,,,,,,,,,,,,,,,,,,,,,,,,,,
37223,US,Aviation Institute of Maintenance-Manassas,,,2023,,Manassas,Virginia,20109,7032575515.0,https://aviationmaintenance.edu/campuses/nova,https://aviationmaintenance.edu/,https://aviationmaintenance.edu/,https://aviationmaintenance.edu/your-rights,-77.514594,38.794493,Yes,"Southeast (AL, AR, FL, GA, KY, LA, MS, NC, SC, TN, VA, WV)",Private for-profit,Non-degree granting,"Nondegree-granting, primarily postsecondary",No,Not applicable,,Suburb: Large,Not applicable,Not applicable,Not applicable,Not applicable,Not applicable,"Under 1,000",189.0,0.0,0.0,,,,91.0,0.0,0.0,,40.0,,16757.0,,37504.0,,,,,,,,,,,,,,,,,,,,,,,,,,,,,,,,,,,,,,,,,,,,,,,,,,,,,,,,,,,,,,,,,,,,,,,,,,,,,,,,,,,,,,,,,,,,,,,,,,,,,,,,,,,,,,,,,,,,,,,,,,,,,,,,,,,,,,,,,,,,,,,,,,,,,,,,,,,,,,,,,,,,,,
2005,US,Cosmetology School of Arts & Sciences,,,2023,CSAS,Burley,Idaho,83318,2086784454.0,cosmetologyschoolof-art.com/,cosmetologyschoolof-art.com/contact-us/,cosmetologyschoolof-art.com/programs/,cosmetologyschoolof-art.com/wp-content/uploads/2022/06/doc01328320220629132418-3.pdf,-113.78718,42.561068,Yes,"Rocky Mountains (CO, ID, MT, UT, WY)",Private for-profit,Non-degree granting,"Nondegree-granting, primarily postsecondary",No,Not applicable,,Town: Distant,Not applicable,Not applicable,Not applicable,Not applicable,Not applicable,"Under 1,000",38.0,0.0,0.0,,,,89.0,0.0,0.0,,83.0,,,,,,,,,,,,,,,,,,,,,,,,,,,,,,,,,,,,,,,,,,,,,,,,,,,,,,,,,,,,,,,,,,,,,,,,,,,,,,,,,,,,,,,,,,,,,,,,,,,,,,,,,,,,,,,,,,,,,,,,,,,,,,,,,,,,,,,,,,,,,,,,,,,,,,,,,,,,,,,,,,,,,,,,,,
2241,US,Universal Technical Institute of Pennsylvania Inc,,,2023,Universal Technical Institute - Exton,Exton,Pennsylvania,19341,8005143554.0,www.uti.edu/,www.uti.edu/request-info,www.uti.edu/,www.uti.edu/admissions/tuition,-75.685133,40.070513,Yes,"Mid East (DE, DC, MD, NJ, NY, PA)",Private for-profit,Associate's degree,Degree-granting,No,Not applicable,,Suburb: Large,Not applicable,Not applicable,Not applicable,Not applicable,Not applicable,"1,000 - 4,999",1004.0,0.0,0.0,,,,96.0,41.0,865038.0,3619.0,54.0,,,,,,,,,,,,,,,,,,,,,,,,,,,,,,,,,,,,,,,,,,,,,,,,,,,,,,,,,,,,,,,,,,,,,,,,,,,,,,,,,,,,,,,,,,,,,,,,,,,,,,,,,,,,,,,,,,,,,,,,,,,,,,,,,,,,,,,,,,,,,,,,,,,,,,,,,,,,,,,,,,,,,,,,,,
37263,US,Kenneth Shuler School of Cosmetology-Spartanburg,,,2023,,Spartanburg,South Carolina,29301,8645876000.0,www.kennethshuler.com/,www.kennethshuler.com/,www.kennethshuler.com/,kennethshuler.com/wp-content/uploads/2023/05/SPT-NPC-2122.html,-81.972727,34.923366,Yes,"Southeast (AL, AR, FL, GA, KY, LA, MS, NC, SC, TN, VA, WV)",Private for-profit,Non-degree granting,"Nondegree-granting, primarily postsecondary",No,Not applicable,,City: Small,Not applicable,Not applicable,Not applicable,Not applicable,Not applicable,"Under 1,000",132.0,0.0,0.0,,,,92.0,25.0,5850.0,308.0,75.0,,,,,,,,,,,,,,,,,,,,,,,,,,,,,,,,,,,,,,,,,,,,,,,,,,,,,,,,,,,,,,,,,,,,,,,,,,,,,,,,,,,,,,,,,,,,,,,,,,,,,,,,,,,,,,,,,,,,,,,,,,,,,,,,,,,,,,,,,,,,,,,,,,,,,,,,,,,,,,,,,,,,,,,,,,
18771,US,Kenneth Shuler School of Cosmetology-Columbia,,,2023,,Columbia,South Carolina,29209,8037769100.0,www.kennethshuler.com/,www.kennethshuler.com/,www.kennethshuler.com/,kennethshuler.com/wp-content/uploads/2023/05/GFRD-NPC-2122.html,-80.942005,33.964545,Yes,"Southeast (AL, AR, FL, GA, KY, LA, MS, NC, SC, TN, VA, WV)",Private for-profit,Non-degree granting,"Nondegree-granting, primarily postsecondary",No,Not applicable,,City: Midsize,Not applicable,Not applicable,Not applicable,Not applicable,Not applicable,"Under 1,000",74.0,0.0,0.0,,,,92.0,15.0,600.0,100.0,63.0,,,,,,,,,,,,,,,,,,,,,,,,,,,,,,,,,,,,,,,,,,,,,,,,,,,,,,,,,,,,,,,,,,,,,,,,,,,,,,,,,,,,,,,,,,,,,,,,,,,,,,,,,,,,,,,,,,,,,,,,,,,,,,,,,,,,,,,,,,,,,,,,,,,,,,,,,,,,,,,,,,,,,,,,,,
27702,US,Divine Mercy University,,,2023,DMU,Sterling,Virginia,20166,7034161441.0,www.divinemercy.edu/,enroll.divinemercy.edu/,enroll.divinemercy.edu/,https://divinemercy.edu/financial-aid/cost-of-attendance/,-77.437576,38.979728,Not applicable,"Southeast (AL, AR, FL, GA, KY, LA, MS, NC, SC, TN, VA, WV)",Private not-for-profit,Doctor's degree -  professional practice,Degree-granting,No,No,,Suburb: Large,Implied no,Yes,Implied no,Yes,Implied no,"Under 1,000",442.0,10.0,,10.0,,,,,,,,,,,,,,,,,,,,,,,,,,,,,,,,,,,,,,,,,,,,,,,,,,,,,,,,,,,,,,,,,,,,,,,,,,,,,,,,,,,,,,,,,,,,,,,,,,,,,,,,,,,,,,,,,,,,,,,,,,,,,,,,,,,,,,,,,,,,,,,,,,,,,,,,,,,,,,,,,,,,,,,,,,,,,,,,,
28566,US,Lincoln Technical Institute-Shelton,,,2023,Lincoln Culinary Institute,Shelton,Connecticut,06484,203929000000000.0,www.lincolntech.edu/campus/shelton-ct,www.lincolntech.edu/campus/shelton-ct,www.lincolntech.edu/campus/shelton-ct,www.lincolntech.edu/net-price-calculator,-73.132014,41.271974,Yes,"New England (CT, ME, MA, NH, RI, VT)",Private for-profit,Non-degree granting,"Nondegree-granting, primarily postsecondary",No,Not applicable,,City: Small,Not applicable,Not applicable,Not applicable,Not applicable,Not applicable,"Under 1,000",798.0,0.0,0.0,,0.0,0.0,90.0,65.0,520244.0,1517.0,55.0,,,,,,,,,,,,,,,,,,,,,,,,,,,,,,,,,,,,,,,,,,,,,,,,,,,,,,,,,,,,,,,,,,,,,,,,,,,,,,,,,,,,,,,,,,,,,,,,,,,,,,,,,,,,,,,,,,,,,,,,,,,,,,,,,,,,,,,,,,,,,,,,,,,,,,,,,,,,,,,,,,,,,,,,,,
